企業コード,上場,商号（カナ）,商号（漢字）,調査年月日,代表者カナ,代表者氏名,郵便番号,所在地,電話番号,設立年月,創業年月,資本金,従業員数,業種,営業種目,役員,大株主,業績,売上伸長率,利益伸長率,営業所・支店,仕入先,販売先,取引銀行,概況,代表者,現住所,生年月日,干支,出身地,出身校
010521976,9  未上場,ｲ - ｶﾑﾄｳﾙ -,（株）イー・カムトゥルー,2022/05/20,ｳｴﾀﾞ  ﾏｻﾐ,上田  正巳,〒 060-0042,北海道札幌市中央区大通西１－１４－２,011-806-1427,2000/05,2000/05,"165,940  千円",26  人,3911  受託開発ソフトウェア業  9121  労働者派遣業  5432  電気機械器具卸売業,ソフトウェア業（９０％），ＩＴ導入コンサルティング，人材派遣業,（取）椛澤弘昭，辻野誠司，高橋康介（監）栄花均，武山渉,ＥＧＳ（２７％），ジェイウイング・キャピタル（１０．３％），浅田一  憲（１０．３％），エフティグループ（６．９％）,"決算年月  売上（千円）  税込引 利益（千円 ） 配当  2019/12  438,253  4,406  2020/12  300,000  -50,000  2021/12  286,372  -25,753",95 ％,,,モアアジア，ファイバーゲート,サイダス，ＩＮＴＬＯＯＰ，空間計画，丸千代山岡家,北洋（札幌南）北陸（札幌）三菱ＵＦＪ（札幌中央）三井住友（札幌）新生信  託  北海道（札幌駅前）商工組合中央金庫（札幌）日本政策金融公庫,自社開発のビジネス用アプリケーションを提供している。２０２１年８月には  「ＴＯＫＹＯＰＲＯＭａｒｋｅｔ」上場を廃止した。,上田  正巳,〒 004-0878  北海道札幌市清田区平岡８条２－１０－３,1965/01/08  生,06  巳,01  北海道,北海学園大学
012292419,9  未上場,ﾅｽｶｺﾝﾋﾟﾕ - ﾀ,（株）ナスカコンピュータ,2022/08/22,ｻｶﾈ  ｱﾂｼ,坂根  厚司,〒 060-0042,北海道札幌市中央区大通西３－１１北洋ビル１０Ｆ,011-213-0130,1994/06,,"10,000  千円",45  人,3911  受託開発ソフトウェア業  9121  労働者派遣業,ソフトウェア開発，労働者派遣業,（専）吉川清志（取）越村隆興，町田定幸，坂根成美,坂根厚司（８５％），越村隆興（１５％）,"決算年月  売上（千円）  税込引 利益（千円 ） 配当  2020/05  311,067  119  2021/05  323,994  247  2022/05  322,092  3,347",99 ％,1355 ％,〔支社店〕島根県出雲市斐川町直江４５８２－２,システムノース（２８．１％），デービスアクト（２７．３％）,北海道日立システムズ（７８．２％），日立システムズ（７．７％），システ  ムグレイ（３．１％）,北海道信金（琴似）北洋（北七条）北海道（札幌駅北口）日本政策金融公庫,大手企業のシステム開発を受託しており、３億円台の売上をコンスタントに上  げている。,坂根  厚司,〒 006-0814  北海道札幌市手稲区前田４条９－１１－１０,1961/02/05  生,02  丑,61  島根県,帯広畜産大学
012298387,9  未上場,ﾄﾗｲﾊﾞﾙﾕﾆﾂﾄ,（株）トライバルユニット,2022/03/14,ﾀﾅｶ  ﾄﾓﾕｷ,田中  智幸,〒 060-0042,北海道札幌市中央区大通西９－３－３３キタコーセンタービルディング３Ｆ,011-200-5111,2010/11,2010/11,"20,000  千円",69  人,9121  労働者派遣業  9299  その他の事業サービス業  3911  受託開発ソフトウェア業,人材派遣・人材紹介事業，ＢＰＯ事業，オフィスリースサポート事業，ア  ライアンス事業,（代副）菊地敏明（取）小山篤，田代慎悟，寺澤正男,,"決算年月  売上（千円）  税込引 利益（千円 ） 配当  2019/10  3,300,000  39,000  2020/10  3,705,000  73,000  2021/10  3,940,000  35,000",106 ％,48 ％,〔支社店〕北海道札幌市中央区北５条西２－５ＪＲタワーオフィスプラザさっ  ぽろ２０Ｆ，東京都新宿区西新宿１－２５－１新宿センタービル２９Ｆ,ファーストリレーションズ，セールスポイント，一般法人,ＫＤＤＩ，ソフトバンク，ビッグローブ，ブロードメディア，ティーガイア，  丸紅テレコム，アイ・ティー・エックス,北洋（札幌駅南口）北陸（札幌）秋田（札幌）三井住友（札幌）ゆうちょ銀行,人材派遣事業を主軸に様々な事業を手掛ける。不採算のコールセンター業務を  関連会社に譲渡し、収益性の改善を図る。,田中  智幸,〒 065-0020  北海道札幌市東区北２０条東２０ー４－１４,1979/06/07  生,08  未,01  北海道,高等学校
010258329,9  未上場,ｲﾝﾌｵﾃｸﾉ,インフォテクノ（株）,2022/06/28,ﾓｲｽﾞﾐ  ｹﾝｲﾁ,茂泉  賢一,〒 060-0042,北海道札幌市中央区大通西１６－１－１０ＩＴＣセンタービル,011-633-9990,1981/11,1981/11,"80,000  千円",89  人,3911  受託開発ソフトウェア業  9121  労働者派遣業,ソフトウエア製作・開発（人材派遣を含む）（９７％），不動産賃貸収入  （３％）,（取）荒木一洋，榎孝幸（監）斎藤豊,一般社団法人ＩＴＣプロパティ（６２．５％），茂泉賢一（２０％）,"決算年月  売上（千円）  税込引 利益（千円 ） 配当  2020/03  1,107,153  48,485  2021/03  1,085,908  33,927  2022/03  983,569  31,136",91 ％,92 ％,〔支社店〕神奈川県横浜市西区高島２－１９－３日通商事ビル８Ｆ,クエスト（１０％），メディカルデータベース，デンソーソリューション，Ｓ  ｙｓｔｅｍ．Ｊ．Ｅ，システムグレイ,北海道ＮＳソリューションズ（２０％），ツルハ（１５％），テックスエンジ  ソリューションズ,北海道（鳥居前）北洋（札幌西）北陸（札幌）みずほ（札幌）りそな（札幌）,調剤薬局向けのシステムを扱うほか、人材派遣を手掛ける。２０２２年３月期  は上海のロックダウンによる影響を受けた。,茂泉  賢一,〒 068-0006  北海道岩見沢市６条東１４－４－１,1967/04/19  生,08  未,01  北海道,高等学校
030147760,9  未上場,ﾏｽﾀ - ｽﾞｼｽﾃﾑ,マスターズシステム（株）,2022/06/14,ｲﾜﾐ  ﾄﾓｱｷ,石見  智明,〒 060-0041,北海道札幌市中央区大通東７－１８－１ノースシティエンジニアビル,011-261-8642,1991/05,1991/05,"22,000  千円",30  人,3911  受託開発ソフトウェア業  3921  情報処理サービス業  9121  労働者派遣業,ソフトウェア開発製造テスト（９２％），ソフトウェア技術者の派遣（８  ％）,（常）越中一夫（取）丹治浩（監）山田廣,山田廣（８１．６％），石見智明（１４．９％），越中一夫（３．４％）,"決算年月  売上（千円）  税込引 利益（千円 ） 配当  2020/03  161,965  8,762  2021/03  151,177  -456  2022/03  151,672  -304",100 ％,,,,エスイーシー，ＢＴＣ，中央システム，アグレックス，ＨＮＳＯＬ，ウィンコ  ンサル,北海道（創成）北海道信金（大通南）,事業比率はソフトウェア開発製造テスト９２％・ソフトウェア技術者の派遣８  ％である。自己資本比率は７６％である。,石見  智明,〒 061-1277  北海道北広島市大曲光３－６－２,1969/02/13  生,10  酉,01  北海道,
